{
  "version": "2.1.0",
  "project_name": "zeroscan",
  "domains": {
    "core": {
      "description": "Core memory engine, state management, and MCP server",
      "entry_points": [
        "core/memory.py",
        "core/mcp_server.py"
      ],
      "files": [
        "core/"
      ],
      "tests": [
        "tests/test_memory.py",
        "tests/test_mcp_server.py"
      ],
      "dependencies": []
    },
    "bootstrap": {
      "description": "Repository scaffolding and template generation engine",
      "entry_points": [
        "bootstrap.py"
      ],
      "files": [
        "bootstrap.py",
        "templates/",
        "schema/"
      ],
      "tests": [
        "tests/test_bootstrap.py"
      ],
      "dependencies": []
    },
    "benchmarks": {
      "description": "Token reduction benchmarks and SWE-bench evaluation engine",
      "entry_points": [
        "benchmarks/evaluator.py"
      ],
      "files": [
        "benchmarks/"
      ],
      "tests": [
        "tests/test_benchmarks.py"
      ],
      "dependencies": []
    }
  },
  "infrastructure": {
    "config_files": [
      "pyproject.toml",
      "README.md",
      "LICENSE"
    ],
    "docs": [
      "README.md",
      "README.vi.md",
      "HUONG_DAN_SU_DUNG.md",
      "USAGE_GUIDE.md"
    ],
    "cicd": [
      ".github/workflows/ci.yml"
    ]
  }
}
